{
	"version": "1.0.0",
	"allow": {
		"origins": ["${MOCKBANK_ORIGIN}"],
		"routes": [
			{
				"origin": "${MOCKBANK_ORIGIN}",
				"include": ["/**"],
				"exclude": ["/__admin/**", "/__health"]
			}
		],
		"actions": ["navigate", "click", "fill", "select", "press", "extract", "wait", "dismiss_dialog"]
	},
	"irreversible": {
		"controlNamePatterns": ["^Confirm$", "^Submit$", "Open Account", "Transfer", "Delete", "cannot be undone"],
		"routes": ["/subaccount/opened"]
	},
	"redaction": {
		"patterns": [
			{
				"name": "ssn",
				"regex": "\\b\\d{3}-\\d{2}-\\d{4}\\b",
				"mask": "full"
			},
			{
				"name": "account-number",
				"regex": "(?<![\\d.,])\\d{10}(?!\\d|[.,]\\d)",
				"mask": "keep_last_4"
			},
			{
				"name": "member-number",
				"regex": "(?<![\\d.,])\\d{5}(?!\\d|[.,]\\d)",
				"mask": "keep_last_2"
			},
			{
				"name": "money-amount",
				"regex": "(?<![\\w.,])(?:-\\$?|\\$-?)?(?:\\d{1,3}(?:,\\d{3})+|\\d+)\\.\\d{2}(?!\\w|[.,]\\d)",
				"mask": "full"
			}
		],
		"terms": ["Jane Sample", "John Placeholder", "Ada Fixture"]
	},
	"approval": {
		"expiresMs": 300000
	}
}
